{
  "role": "reviewer",
  "invocationId": "00000000000000000000000000000000",
  "contractSha256": "0000000000000000000000000000000000000000000000000000000000000000",
  "artifactSchemaSha256": "0000000000000000000000000000000000000000000000000000000000000000",
  "processId": null,
  "started": false,
  "startedAt": "2026-07-20T00:00:00Z",
  "completedAt": "2026-07-20T00:00:00Z",
  "completionObservedAt": "2026-07-20T00:00:00Z",
  "absoluteDeadline": "2026-07-20T00:15:00Z",
  "startError": null,
  "stdinDelivered": false,
  "stdinError": null,
  "exitCode": null,
  "timedOut": false,
  "argv": [
    "-a",
    "never",
    "-m",
    "gpt-5.4",
    "-c",
    "model_reasoning_effort=\"xhigh\"",
    "exec",
    "--ephemeral",
    "--ignore-user-config",
    "--skip-git-repo-check",
    "--sandbox",
    "read-only",
    "--json",
    "--add-dir",
    "C:\\absolute\\runtime\\temp",
    "--add-dir",
    "C:\\absolute\\runtime\\cache",
    "--add-dir",
    "C:\\absolute\\runtime\\deps",
    "-C",
    "C:\\absolute\\snapshot",
    "-o",
    "C:\\absolute\\evidence\\final.json",
    "-"
  ],
  "argvSha256": "0000000000000000000000000000000000000000000000000000000000000000",
  "promptSha256": "0000000000000000000000000000000000000000000000000000000000000000",
  "stdoutPath": "C:\\absolute\\evidence\\stdout.jsonl",
  "stdoutSha256": "0000000000000000000000000000000000000000000000000000000000000000",
  "stderrPath": "C:\\absolute\\evidence\\stderr.txt",
  "stderrSha256": "0000000000000000000000000000000000000000000000000000000000000000",
  "finalPath": "C:\\absolute\\evidence\\final.json",
  "finalSha256": null,
  "finalSchemaValid": null,
  "artifactBindingValid": null,
  "inputCommit": "0000000000000000000000000000000000000000",
  "supervisorCommit": null,
  "supervisorCommitTree": null,
  "supervisorCommitScriptSha256": "0000000000000000000000000000000000000000000000000000000000000000",
  "supervisorCommitError": null,
  "threadIds": [],
  "turnCompleted": false,
  "rawJsonlValid": false,
  "unauthorizedToolOrWriteDetected": null,
  "unauthorizedToolOrWriteUnavailableReason": "runner cannot observe every external tool or write; scoped input checks are recorded separately",
  "sandboxMode": "read-only",
  "inputDisposition": "read-only-snapshot",
  "isolationEnforcedBy": "audited-procedural-boundary-plus-cli-sandbox",
  "usage": null,
  "usageUnavailableReason": "required at run when turn.completed omits usage",
  "runtimeModel": null,
  "runtimeModelUnavailableReason": "required at run when trusted JSONL omits model",
  "runtimeProvider": null,
  "runtimeProviderUnavailableReason": "required at run when trusted JSONL omits provider",
  "reasoningSetting": null,
  "reasoningSettingUnavailableReason": "required at run when trusted JSONL omits reasoning",
  "metadataSource": "unavailable"
}
